URL,IDs
https://www.healthdirect.gov.au/pain-question-planner,
https://www.healthdirect.gov.au/health-topics,
https://www.healthdirect.gov.au/getting-the-facts-on-ct-scans-for-children-new-online-gateway-launched,
https://www.healthdirect.gov.au/choosing-wisely-campaign-2016,
https://www.healthdirect.gov.au/new-app-to-help-australians-make-smarter-health-decisions,
https://www.healthdirect.gov.au/healthdirect-australia-four-million-callers,
https://www.healthdirect.gov.au/expanded-pregnancy-birth-and-baby-service-launched-today,
https://www.healthdirect.gov.au/5-million-Australians-access-health-advice-via-phone,
https://www.healthdirect.gov.au/new-national-aged-care-contact-centre-tender,
https://www.healthdirect.gov.au/eye-diseases-unpublished,
https://www.healthdirect.gov.au/118000-australians-access-after-hours-gp-helpline,
https://www.healthdirect.gov.au/new-app-helps-you-locate-a-doctor-wherever-you-are,
https://www.healthdirect.gov.au/study-reveals-first-year-of-parenthood-struggles-pr,
https://www.healthdirect.gov.au/our-board,
https://www.healthdirect.gov.au/new-national-aged-care-contact-centre-industry-briefing-media-release,
https://www.healthdirect.gov.au/healthdirect-australia-three-million-and-counting,
https://www.healthdirect.gov.au/nine-tell-tale-signs-of-mental-health-issues,
https://www.healthdirect.gov.au/after-hours-gp-helpline-reaches-a-milestone,
https://www.healthdirect.gov.au/blog,
https://www.healthdirect.gov.au/page-not-found,
https://www.healthdirect.gov.au/access-denied,
https://www.healthdirect.gov.au/information-partners,
https://www.healthdirect.gov.au/the-australian-health-thesaurus-aht,
https://www.healthdirect.gov.au/stool-changes,
https://www.healthdirect.gov.au/how-is-dementia-diagnosed-video-transcript,
https://www.healthdirect.gov.au/living-well-with-dementia-video-transcript,
https://www.healthdirect.gov.au/dementia-and-personality-changes-video-transcript,
https://www.healthdirect.gov.au/delaying-dementia-progress-video-transcript,
https://www.healthdirect.gov.au/dementia-decline-video-transcript,
https://www.healthdirect.gov.au/how-to-reduce-your-risk-of-dementia-video-transcript,
https://www.healthdirect.gov.au/dementia-and-shared-decision-making-video-transcript,
https://www.healthdirect.gov.au/decisions-to-make-after-dementia-diagnosis-video-transcript,
https://www.healthdirect.gov.au/question-builder,
https://www.healthdirect.gov.au/healthdirect-australia-social-media-acceptable-use-policy,
https://www.healthdirect.gov.au/worrytime,
https://www.healthdirect.gov.au/rectal-diseases,
https://www.healthdirect.gov.au/listeria-and-listeriosis,"key-facts, what-is, causes, symptoms, diagnosis, treated, prevented, doctor, information"
https://www.healthdirect.gov.au/dementia-care-options-video-transcript,
https://www.healthdirect.gov.au/no-search-results,
https://www.healthdirect.gov.au/metabolism,"what-is, measured, how, affects, increase, resources"
https://www.healthdirect.gov.au/kiss-my-asthma-app,
https://www.healthdirect.gov.au/daybreak-app-alcohol-support,
https://www.healthdirect.gov.au/counterpart-navigator-app,
https://www.healthdirect.gov.au/upbeat-teen-app,
https://www.healthdirect.gov.au/smallpox,"key-facts, smallpox, symptoms, causes, diagnosed, treated, prevented, complications, managed, same, resources"
https://www.healthdirect.gov.au/sunscreen,"key-facts, what-is, used-for, types, work, when, doctor, resources"
https://www.healthdirect.gov.au/healthy-mind-online-program-black-dog-institute,
https://www.healthdirect.gov.au/tens,"key-facts, what-is, how, treatment, relieving-pain, side-effects, when, how-to-get"
https://www.healthdirect.gov.au/urinary-problems,
https://www.healthdirect.gov.au/tourette-syndrome,"what-is, symptoms, diagnosed, treated, complications, resources"
https://www.healthdirect.gov.au/australian-health-services,
https://www.healthdirect.gov.au/questions-to-ask-your-doctor,"ask, health, treatments, tests, resources"
https://www.healthdirect.gov.au/residential-care,"what-is, need, access, cost, caring, resources"
https://www.healthdirect.gov.au/nurse,"what, types, community-health-nurses"
https://www.healthdirect.gov.au/parechovirus,"key-facts, what, how, symptoms, when, diagnosed, treated, prevented, resources"
https://www.healthdirect.gov.au/down-syndrome-good-health-app,
https://www.healthdirect.gov.au/braintrack-app,
https://www.healthdirect.gov.au/sleep-ninja-app,
https://www.healthdirect.gov.au/healthy-food-swaps,"key-facts, benefits, swaps, start, information"
https://www.healthdirect.gov.au/undescended-testicles,"what, symptoms, causes, doctor, diagnosed, treated, not-treated, resources"
https://www.healthdirect.gov.au/financial-stress,"impact, cause, minimise, job, help, resources"
https://www.healthdirect.gov.au/ibs-infographic,
https://www.healthdirect.gov.au/thyroid-medicines,"what-is, how, types, take, side-effects, doctor, pregnancy, alternatives, resources"
https://www.healthdirect.gov.au/informed-consent,"key-facts, what-is, medical-procedures, legal-requirements, legal-capacity, explained-before, how, change-mind, resources"
https://www.healthdirect.gov.au/phobias-overview,"key-facts, what-is, social-phobia, specific, why, diagnosis, treatment, resources"
https://www.healthdirect.gov.au/melancholia,"key-facts, what-is, symptoms, diagnosed, treated, information"
https://www.healthdirect.gov.au/separation-anxiety,"what-is, symptoms, causes, doctor, diagnosed, treated, carers, resources"
https://www.healthdirect.gov.au/diuretic-medicines,"key-facts, what-are, uses, prescribed, work, who, take, risks, side-effects, doctor, alternatives, resources"
https://www.healthdirect.gov.au/zinc-deficiency,"what-is, deficiency, symptoms, causes, diagnosed, treated, prevented, resources"
https://www.healthdirect.gov.au/foods-high-in-zinc,"what-is, where, how-much, sources, supplement, resources"
https://www.healthdirect.gov.au/management-of-chronic-conditions,"what-is, how, health-professionals, manage, mental, support, more"
https://www.healthdirect.gov.au/irritable-bowel-syndrome-ibs,"key-facts, what-is, symptoms, causes, doctor, diagnosis, treatment, reduce-symptoms, complications, resources"
https://www.healthdirect.gov.au/klinefelter-syndrome,"key-facts, what-is, causes, symptoms, diagnosed, affects, treated, information"
https://www.healthdirect.gov.au/sunny-app,
https://www.healthdirect.gov.au/mood-disorders,
https://www.healthdirect.gov.au/hashimotos-disease,"what-is, symptoms, causes, diagnosed, treated, prevented, complications, resources"
https://www.healthdirect.gov.au/blood-tests-a-z,
https://www.healthdirect.gov.au/preparing-for-a-death-at-home,"prepare, legal-documents, after, coroner, days-and-weeks-after, funeral, notify, resources"
https://www.healthdirect.gov.au/potassium-deficiency,"what, deficiency, symptoms, causes, diganosed, treated, prevented, support"
https://www.healthdirect.gov.au/shoulder-pain,"key-facts, what-is, symptoms, causes, doctor, diagnosed, treated, prevented, resources"
https://www.healthdirect.gov.au/sexual-harassment,"key-facts, what-is, impact-me, steps-to-take, workplace, resources"
https://www.healthdirect.gov.au/dust-mites,"key-facts, what, where, health, symptoms, get-rid, resources"
https://www.healthdirect.gov.au/potassium,"what, do, little, need, support"
https://www.healthdirect.gov.au/zinc,"what-is, what-does, too-much, how-much, enough, resources"
https://www.healthdirect.gov.au/glandular-fever,"key-facts, what-is, symptoms, causes, doctor, diagnosis, prevention, complications, resources"
https://www.healthdirect.gov.au/toenail-infection,"what-is, why, symptoms, complications, diagnosed, treat, prevent"
https://www.healthdirect.gov.au/manage-medicine,
https://www.healthdirect.gov.au/what-were-we-thinking,
https://www.healthdirect.gov.au/food-poisoning,"what-is, symptoms, caused, doctor, diagnosed, treated, prevented, complications, resources"
https://www.healthdirect.gov.au/gambling-addiction,"problem, someone, addiction, why, where, resources"
https://www.healthdirect.gov.au/barbecue-food-safety,"key-facts, safety-risks, cooking-meat, keeping-food-cool, preventing-germs, barbecuing-safely, resources"
https://www.healthdirect.gov.au/headcheck-app,
https://www.healthdirect.gov.au/first-aid-app-australian-red-cross,
https://www.healthdirect.gov.au/down-syndrome-health-record-app,
https://www.healthdirect.gov.au/daisy-app,
https://www.healthdirect.gov.au/asthma-first-aid-app,
https://www.healthdirect.gov.au/kids-guide-to-cancer-app,
https://www.healthdirect.gov.au/feed-safe-app,
https://www.healthdirect.gov.au/get-prepared-app,
https://www.healthdirect.gov.au/nrs-app,
https://www.healthdirect.gov.au/colposcopy,"key-facts, what, performed, pregnant, prepare, during, after, complications, resources"
https://www.healthdirect.gov.au/protein,"what-is, used-for, how-much, foods, diets, resources"
https://www.healthdirect.gov.au/scoliosis,"what-is, symptoms, caused, doctor, diagnosed, treated, prevented, complications, resources"
https://www.healthdirect.gov.au/chronic-lymphocytic-leukaemia-cll,"what-is, caused, symptoms, doctor, diagnosed, treated, living-with, complications, resources"
https://www.healthdirect.gov.au/iodine-deficiency,"key-facts, what-is, deficiency, symptoms, at-risk, diagnosed, treated, prevented, complications, resources"
https://www.healthdirect.gov.au/shingles-infographic,
https://www.healthdirect.gov.au/dopamine,"what, role, little, levels, doctor, support"
https://www.healthdirect.gov.au/food-safety-infographic,
https://www.healthdirect.gov.au/gestational-diabetes,"key-facts, what-is, symptoms, causes, diagnosed, managed, subsidised-services, prevented, complications, resources"
https://www.healthdirect.gov.au/what-is-a-referral,"key-facts, what-is, who, what-info, how, cost, without-referral, how-long, sharing-info, second-opinion, resources"
https://www.healthdirect.gov.au/what-to-expect-in-a-hospital-intensive-care-unit,"key-facts, what-is, why, what-happens, before, when-visiting, after-discharge, resources"
https://www.healthdirect.gov.au/social-workers,"key-facts, what-is, training, what, where, when, find, resources"
https://www.healthdirect.gov.au/learning-disabilities,"what-are, symptoms, causes, diagnosed, doctor, treated, prevented, complications, resources"
https://www.healthdirect.gov.au/otosclerosis,"what-is, symptoms, diagnosed, treated, doctor, living-with, resources"
https://www.healthdirect.gov.au/lipoedema,"what-is, symptoms, causes, doctor, diagnosed, managed, prevented, complications, resources"
https://www.healthdirect.gov.au/porphyria,"key-facts, what-is, symptoms, causes, doctor, diagnosed, treated, prevented, complications, resources"
https://www.healthdirect.gov.au/buying-medicines-online,"online, online-safety, in-australia, overseas, regulated, resources"
https://www.healthdirect.gov.au/adenoidectomy,"key-facts, what-is, when, prepare, during, recovering, risks, resources"
https://www.healthdirect.gov.au/developmental-milestones,"what-is, measure, when, problems, resources"
https://www.healthdirect.gov.au/meditation,"what-is, benefits, how, resources"
https://www.healthdirect.gov.au/thyroidectomy,"key-facts, what-is, when, prepare, during, recovery, complications, alternatives, resources"
https://www.healthdirect.gov.au/salpingectomy,"key-facts, what-is, when, prepare, during, recovery, risks, resources"
https://www.healthdirect.gov.au/absence-seizures,"what-is, symptoms, treated, doctor, resources"
https://www.healthdirect.gov.au/dental-erosion,"key-facts, what-is, symptoms, causes, dentist, treatment, prevention, resources"
https://www.healthdirect.gov.au/colostomy,"key-facts, what-is, when, prepare, during, recovering, complications, alternatives, resources"
https://www.healthdirect.gov.au/plantar-fasciitis,"what-is, symptoms, caused, doctor, diagnosed, treated, prevented, complications, resources"
https://www.healthdirect.gov.au/objects-in-ear,"key-facts, what-is, symptoms, managed, doctor, diagnosis, treatment, prevention, complications, resources"
https://www.healthdirect.gov.au/delirium,"key-facts, what-is, symptoms, causes, risk, diagnosed, treatment, prevented, complications, resources"
https://www.healthdirect.gov.au/neutropenia,"key-facts, what-is, febrile, causes, symptoms, diagnosed, prevent"
https://www.healthdirect.gov.au/bowel-obstruction,"what-is, symptoms, causes, pseudo-obstruction, diagnosed, treatment, prevent, resources"
https://www.healthdirect.gov.au/low-fodmap-diets,"what-is, how, foods, start, possible, work, resources"
https://www.healthdirect.gov.au/fluid-from-the-ear,"key-facts, what-is, symptoms, causes, doctor, diagnosed, treated, prevented, complications, resources"
https://www.healthdirect.gov.au/huntingtons-disease,"what-is, symptoms, caused, doctor, diagnosed, managed, prevented, resources"
https://www.healthdirect.gov.au/hydrocephalus,"key-facts, what-is, symptoms, causes, doctor, diagnosed, treated, prevented, complications, resources"
https://www.healthdirect.gov.au/amnesia,"what-is, symptoms, causes, doctor, diagnosed, treated, prevented, complications, resources"
https://www.healthdirect.gov.au/agoraphobia,"what-is, symptoms, causes, doctor, diagnosed, treated, prevented, complications, resources"
https://www.healthdirect.gov.au/medicine-recalls,"key-facts, what-is, makes, regulates, what-to-do, report, resources"
https://www.healthdirect.gov.au/hcg-levels,"key-facts, what-is, pregnancy, levels, multiple-pregnancies, resources"
https://www.healthdirect.gov.au/app-user-account-faqs,
https://www.healthdirect.gov.au/user-account-faqs,
https://www.healthdirect.gov.au/benefits-of-volunteering,"explained, what, social, more"
https://www.healthdirect.gov.au/hiccups,"what-is, causes, babies, stop"
https://www.healthdirect.gov.au/giardiasis,"key-facts, what-is, symptoms, causes, diagnosis, treatment, prevention"
https://www.healthdirect.gov.au/tonsil-stones,"key-facts, what, symptoms, causes, diagnosed, treated, doctor, surgery, prevent"
https://www.healthdirect.gov.au/osteomyelitis,"what, symptoms, causes, doctor, diagnosed, treated, support"
https://www.healthdirect.gov.au/erythromelalgia,"key-facts, what-is, symptoms, causes, doctor, diagnosis, treatment, prevention, complications, resources"
https://www.healthdirect.gov.au/symptom-checker,
https://www.healthdirect.gov.au/malnutrition,"key-facts, what-is, symptoms, causes, doctor, diagnosed, treated, prevented, complications, resources"
https://www.healthdirect.gov.au/health-app,
https://www.healthdirect.gov.au/erythema-nodosum,"key-facts, what-is, symptoms, causes, diagnosis, treatment, resources"
https://www.healthdirect.gov.au/cholera,"key-facts, what-is, symptoms, causes, doctor, diagnosed, treated, prevented, complications, resources"
https://www.healthdirect.gov.au/rhabdomyolysis,"what-is, symptoms, caused, diagnosed, treated, complications, prevented, doctor, resources"
https://www.healthdirect.gov.au/rotavirus,"key-facts, what-is, symptoms, causes, doctor, diagnosed, treated, prevented, complications, resources"
https://www.healthdirect.gov.au/gastroparesis,"what-is, causes, symptoms, doctor, diagnosed, managed, resources"
https://www.healthdirect.gov.au/basal-cell-carcinoma,"what-is, symptoms, causes, types, doctor, diagnosed, treated, prevented, resources"
https://www.healthdirect.gov.au/7-ways-pets-improve-your-health,"stress, companionship, purpose, social, fitness, heart, allergies, assitance, resources"
https://www.healthdirect.gov.au/primary-amoebic-meningoencephalitis-pam,"what-is, symptoms, causes, doctor, diagnosed, treated, prevented, complications, resources"
https://www.healthdirect.gov.au/pollen-allergy,"what, symptoms, how, treated, manage, support"
https://www.healthdirect.gov.au/congenital-heart-disease,"what-is, types, symptoms, caused, doctor, diagnosed, treated, complications, resources"
https://www.healthdirect.gov.au/rotator-cuff-injury,"what-is, symptoms, causes, doctor, diagnosed, treated, prevented"
https://www.healthdirect.gov.au/gluten-free-diet,
https://www.healthdirect.gov.au/coeliac-disease,"what-is, symptoms, causes, doctor, diagnosed, managed, prevented, complications, resources"
https://www.healthdirect.gov.au/vitiligo,"key-facts, what-is, symptoms, causes, diagnosed, treated, resources"
https://www.healthdirect.gov.au/gastritis,"key-facts, what-is, symptoms, causes, doctor, diagnosis, treatment, prevention, complications, resources"
https://www.healthdirect.gov.au/dandruff,"key-facts, what-is, symptoms, causes, doctor, diagnosis, treatment, prevention, complications, resources"
https://www.healthdirect.gov.au/granulomas,"what-is, types, caused, other-conditions, diagnosed, treated, cancer, resources"
https://www.healthdirect.gov.au/muscle-aches-and-pains,"key-facts, what-is, symptoms, causes, doctor, diagnosis, treatment, prevention, complications, resources"
https://www.healthdirect.gov.au/talking-to-your-employer-about-illness,"leave, type, fired, employer, share, how, telling, support"
https://www.healthdirect.gov.au/laxatives,"what-is, how, take, used, side-effects, doctor, alternatives, resources"
https://www.healthdirect.gov.au/haemolytic-uraemic-syndrome-hus,"key-facts, what-is, symptoms, causes, doctor, diagnosed, treated, prevented, complications, resources"
https://www.healthdirect.gov.au/food-drink-and-mental-health,"affect, connected, improve, doctor, resources"
https://www.healthdirect.gov.au/electroconvulsive-therapy-ect,"what-is, when, how, side-effects, repetitive, more"
https://www.healthdirect.gov.au/choking,"what, symptoms, first-aid, recovery, risk, prevented, games, support"
https://www.healthdirect.gov.au/workplace-bullying,"what-is, examples, what-to-do, rights, witness, expect, resources"
https://www.healthdirect.gov.au/the-physical-process-of-dying,"what-is, weeks, days, 24-hours, hours, dies, after, feel, resources"
https://www.healthdirect.gov.au/probiotics,"what-are, benefits, types, prebiotics, when, doctor, resources"
https://www.healthdirect.gov.au/itchy-eyes,"what-is, symptoms, causes, doctor, diagnosed, treated, prevented, resources"
https://www.healthdirect.gov.au/group-a-streptococcal,"key-facts, what-is, what-is-infection, symptoms, causes, doctor, diagnosis, treatment, prevention, complications, resources"
https://www.healthdirect.gov.au/scarlet-fever,"what-is, symptoms, causes, doctor, diagnosed, treated, prevented, complications, resources"
https://www.healthdirect.gov.au/ingrown-hair,"what-is, symptoms, causes, doctor, diagnosed, treated, prevented, complications, resources"
https://www.healthdirect.gov.au/metastatic-breast-cancer,"what, symptoms, causes, when, how, treated, can, complications, support"
https://www.healthdirect.gov.au/racgp-healthy-habits,
https://www.healthdirect.gov.au/dyspraxia,"what-is, symptoms, caused, doctor, diagnosed, treated, prevented, complications, resources"
https://www.healthdirect.gov.au/follicle-stimulating-hormone,"what-is, role, measured, needed, important"
https://www.healthdirect.gov.au/spinal-muscular-atrophy-sma,"what-is, types, symptoms, causes, doctor, diagnosed, treated, prevented, complications, resources"
https://www.healthdirect.gov.au/binge-eating-disorder-bed,"what-is, causes, symptoms, doctor, diagnosed, treated, prevented, complications, resources"
https://www.healthdirect.gov.au/mental-health-services-infographic,
https://www.healthdirect.gov.au/aortic-coarctation,"what-is, symptoms, causes, doctor, diagnosed, treated, complications, resources"
https://www.healthdirect.gov.au/dementia-early-signs-video-transcript,
https://www.healthdirect.gov.au/dementia-treatments-video-transcript,
https://www.healthdirect.gov.au/eating-disorders,"what-is, common, symptoms, causes, diagnosed, treatments, think, help, resources"
https://www.healthdirect.gov.au/leg-pain,"what-is, symptoms, causes, doctor, treated, prevented, resources"
https://www.healthdirect.gov.au/healthy-holiday-tips-infographic,
https://www.healthdirect.gov.au/hay-fever,"what-is, symptoms, causes, doctor, diagnosed, treated, complications, resources, languages"
https://www.healthdirect.gov.au/craniosynostosis,"what-is, symptoms, caused, doctor, diagnosed, treated, prevented, complications, resources"
https://www.healthdirect.gov.au/dupuytrens-contracture,"what-is, symptoms, caused, doctor, diagnosed, treated, resources"
https://www.healthdirect.gov.au/motion-sickness,"key-facts, what-is, symptoms, causes, diagnosed, treatment, resources"
https://www.healthdirect.gov.au/body-piercing,"body-piercing, tattooing, risks, before, expect, getting, doctor, after, tattoo, support"
https://www.healthdirect.gov.au/escript-electronic-prescription,"what-is, different, benefits, work, prescribed, how, use, manage, asl, resources"
https://www.healthdirect.gov.au/lipoma,"key-facts, what-is, symptoms, causes, doctor, diagnosis, treatment, prevention, complications, resources"
https://www.healthdirect.gov.au/water-and-your-health,
https://www.healthdirect.gov.au/blisters,"what-is, symptoms, causes, treated, doctor, prevented, resources"
https://www.healthdirect.gov.au/anorexia-nervosa,"what-is, types, symptoms, causes, doctor, diagnosed, treated, complications, resources"
https://www.healthdirect.gov.au/dizziness,"what-is, symptoms, causes, doctor, diagnosed, treated, prevented, complications, resources"
https://www.healthdirect.gov.au/vertigo,"what-is, symptoms, causes, diagnosed, treated, resources"
https://www.healthdirect.gov.au/urine-colour-chart,
https://www.healthdirect.gov.au/cognitive-behaviour-therapy-cbt,"what-is, how, help, who, expect, stages, doesnt-work, how-long, resources"
https://www.healthdirect.gov.au/resilience,"what-is, coping, resilience, resources"
https://www.healthdirect.gov.au/dietary-fats,"what-is, good, include, best, tips"
https://www.healthdirect.gov.au/primary-aldosteronism,"what-is, symptoms, causes, doctor, diagnosed, treated, prevented, complications, resources"
https://www.healthdirect.gov.au/emotional-intelligence,"what-is, benefits, skills, signs, increase, help, resources"
https://www.healthdirect.gov.au/medicare-safety-net,"what-is, how, covered, get, net, resources"
https://www.healthdirect.gov.au/what-is-dementia-video-transcript,
https://www.healthdirect.gov.au/hives,"key-facts, what-is, symptoms, causes, doctor, diagnosis, treatment, prevention, resources"
https://www.healthdirect.gov.au/panic-attacks-and-panic-disorder,"what-is, doctor, different, resources"
https://www.healthdirect.gov.au/lightheadedness,"key-facts, what, causes, doctor, treated, prevent, resources"
https://www.healthdirect.gov.au/goitre,"what-is, symptoms, causes, doctor, diagnosed, treated, prevented, complications, resources"
https://www.healthdirect.gov.au/unpleasant-thoughts,
https://www.healthdirect.gov.au/dust-storms,"key-facts, what, health, doctor, precautions, resources"
https://www.healthdirect.gov.au/graves-disease,"what-is, symptoms, causes, diagnosed, treated, resources"
https://www.healthdirect.gov.au/objects-in-nose,"key-facts, what-is, doctor, diagnosed, treated, prevented, complications, resources"
https://www.healthdirect.gov.au/group-b-streptococcal,"key-facts, what-is, symptoms, causes, doctor, diagnosis, treatment, prevention, complications, resources"
https://www.healthdirect.gov.au/disorientation,"what-is, symptoms, doctor, causes, treated, prevent, resources"
https://www.healthdirect.gov.au/circumcision,"key-facts, what-is, why, physical-risks, health-advice, foreskin, circumcised-care, uncircumcised-care, resources"
https://www.healthdirect.gov.au/adenoids,"what-is, function, conditions, diagnosed, treated, resources"
https://www.healthdirect.gov.au/angiotensin-converting-enzyme-inhibitors-ace-and-angiotensin-receptor-blockers-arbs,"key-facts, what-are, work, type, side-effects, doctor, resources"
https://www.healthdirect.gov.au/ciguatera-poisoning,"what-is, symptoms, causes, doctor, diagnosis, treatment, prevention, complications, resources"
https://www.healthdirect.gov.au/adhd-medicine,"key-facts, what-is, types, how, prescribe, side-effects, doctor, alternatives, resources"
https://www.healthdirect.gov.au/tips-for-getting-active,
https://www.healthdirect.gov.au/health-benefits-of-swimming,"key-facts, what-is, who, confident, start, equipment, avoid, motivated, find"
https://www.healthdirect.gov.au/coping-with-a-terminal-illness,"key-facts, what, diagnosed, friends, help, care, involved, support, resources"
https://www.healthdirect.gov.au/strength-training-for-beginners,"key-facts, what, benefits, who, start, equipment, avoid-injury, motivated, guides"
https://www.healthdirect.gov.au/mental-health-first-aid,"key-facts, what-is, types, training, who, access, resources"
https://www.healthdirect.gov.au/puberty-for-boys,"what-is, begin, body-change, relationship-changes, parent, resources"
https://www.healthdirect.gov.au/puberty-for-girls,"what-is, begin, body-change, menstruation, body-image, relationship-changes, parent, resources"
https://www.healthdirect.gov.au/hand-washing,"hygiene, when-wash, how, hand-sanitiser, other-tips"
https://www.healthdirect.gov.au/osteoporosis-medicines,"key-facts, what-is, how, types, side-effects, doctor, alternatives, resources"
https://www.healthdirect.gov.au/yellow-fever,"what-is, causes, symptoms, doctor, diagnosed, treated, prevented, complications, resources"
https://www.healthdirect.gov.au/costochondritis,"key-facts, what-is, symptoms, causes, doctor, diagnosed, treatment, resources"
https://www.healthdirect.gov.au/constipation,"key-facts, what-is, symptoms, causes, diagnosis, doctor, treatment, prevention, complications, resources"
https://www.healthdirect.gov.au/voluntary-assisted-dying,"what-is, legal, eligibility, conditions, care, who, process, support, carers, resources"
https://www.healthdirect.gov.au/hand-foot-and-mouth-disease,"what-is, symptoms, causes, diagnosed, treated, doctor, complications, prevent, resources"
https://www.healthdirect.gov.au/school-exclusion-periods,
