URL,IDs
https://www.healthdirect.gov.au/optic-neuritis,"what-is, symptoms, causes, doctor, diagnosed, treated, prevented, complications, resources"
https://www.healthdirect.gov.au/corneal-ulcers,"what-are, symtoms, causes, doctor, diagnosed, treated, prevented, complications, resources"
https://www.healthdirect.gov.au/facial-injury,"key-facts, what-are, causes, ambulance, treated, help, resources"
https://www.healthdirect.gov.au/conjunctivitis,"what-is, symptoms, causes, diagnosed, doctor, treated, prevented, complications, resources"
https://www.healthdirect.gov.au/fatty-liver,"what-is, symptoms, caused, doctor, diagnosed, treated, prevented, complications, resources"
https://www.healthdirect.gov.au/jaundice,"what-is, symptoms, caused, diagnosed, doctor, treated, prevented, complications, resources"
https://www.healthdirect.gov.au/sildenafil-viagra,"key-facts, what-is, work, use, side-effects, shouldnt, buy, viagra-women, alternatives, resources"
https://www.healthdirect.gov.au/uveitis,"what-is, symptoms, causes, diagnosed, treated, prevented, complications, resources"
https://www.healthdirect.gov.au/dry-eye-disease,"what-are, symptoms, causes, diagnosed, doctor, treated, prevented, complications, resources"
https://www.healthdirect.gov.au/facelift,"key-facts, what-is, thinking, choose, questions, prepare, during, expect-after, risks, non-surgical, cost, resources"
https://www.healthdirect.gov.au/accidents-and-injuries,
https://www.healthdirect.gov.au/aortic-stenosis,"key-facts, what-is, symptoms, causes, doctor, diagnosis, treatment, complications, resources"
https://www.healthdirect.gov.au/blood-and-blood-vessels,"what-is, made-of, cells, plasma, tests, types, vessels, diseases, resources"
https://www.healthdirect.gov.au/aortic-valve-replacement,"what-is, when, prepare, during, recovering, risks, resources"
https://www.healthdirect.gov.au/heart,"what-is, function, parts, how, conditions, take-care, resources"
https://www.healthdirect.gov.au/hepatitis,"what-is, symptoms, causes, spread, doctor, diagnosed, treated, prevented, resources"
https://www.healthdirect.gov.au/hepatitis-b,"key-facts, what-is, symptoms, causes, diagnosed, treated, complications, resources"
https://www.healthdirect.gov.au/hepatitis-a,"what-is, symptoms, causes, doctor, diagnosed, treated, complications, prevented, resources"
https://www.healthdirect.gov.au/hepatitis-c,"key-facts, what-is, symptoms, causes, diagnosed, treated, prevented, resources"
https://www.healthdirect.gov.au/vaccine-preventable-diseases,
https://www.healthdirect.gov.au/gord-reflux,"what-is, symptoms, causes, doctor, diagnosed, treated, prevent, complications, resources"
https://www.healthdirect.gov.au/gastro-intestinal-illnesses,
https://www.healthdirect.gov.au/healthy-bones,"key-facts, what-are, important, symptoms, at-risk, ageing, improve, doctor, resources"
https://www.healthdirect.gov.au/resting-heart-rate,"what-is, normal, check, factors, blood-pressure, slow, fast, resources"
https://www.healthdirect.gov.au/should-i-be-tested-for-heart-disease,"what-is, risk, check, during, follow-up, symptoms, tests, resources"
https://www.healthdirect.gov.au/bradycardia,"what-is, symptoms, causes, doctor, diagnosed, treated, complications, prevent, resources"
https://www.healthdirect.gov.au/liver-conditions-and-diseases,
https://www.healthdirect.gov.au/goal-setting,"what-are, why, how, SMART, resources"
https://www.healthdirect.gov.au/motivation-how-to-get-started-and-staying-motivated,"what-is, why, get-motivated, goals, stay-motivated, lost-motivation, get-help"
https://www.healthdirect.gov.au/opioid-medicines-and-pain-faqs,"what-are, used-for, difference, risk, naloxone, doctor, pain-free, tolerance-dependence, addicted, stop, instead, other, affect-access, more-info"
https://www.healthdirect.gov.au/chronic-pain,"key-facts, what-is, causes, conditions, impact, manage, which-medicines, opioid-medicines, resources"
https://www.healthdirect.gov.au/aches-and-pains,
https://www.healthdirect.gov.au/beta-blockers,"what-is, how, used-for, risks, resources"
https://www.healthdirect.gov.au/low-blood-pressure-hypotension,"what-is, low, problems, symptoms, causes, doctor, treated, complications, resources"
https://www.healthdirect.gov.au/how-to-lower-blood-pressure,"key-facts, what-is, how-do-i-know, measurement, what-is-considered, how-often, risks, lower, medicines, resources"
https://www.healthdirect.gov.au/seniors-health,
https://www.healthdirect.gov.au/what-is-a-healthy-blood-pressure,"what-is, measured, hypertension, hypotension, healthy, lower, resources"
https://www.healthdirect.gov.au/sleep-disorders,
https://www.healthdirect.gov.au/insomnia,"insomnia, symptoms, caused, doctor, diagnosed, treated, complications, resources"
https://www.healthdirect.gov.au/staph-infections,"what-is, symptoms, causes, doctor, risk, treated, mrsa, prevent, complications, resources"
https://www.healthdirect.gov.au/invasive-staph-infections,"what-is, symptoms, mrsa, doctor, avoid, resources"
https://www.healthdirect.gov.au/heartburn,"key-facts, what-is, symptoms, causes, triggers, doctor, diagnosed, treatment, complications, resources"
https://www.healthdirect.gov.au/calling-triple-zero,"key-facts, when-to-call, ambulance, what-happens, how, waiting, tips, help-others, where-else"
https://www.healthdirect.gov.au/joint-pain-and-swelling,"key-facts, what-is, symptoms, causes, doctor, treatment, prevention, resources"
https://www.healthdirect.gov.au/bakers-cysts,"what-is, symptoms, causes, diagnosed, treated, complications, prevent, resources"
https://www.healthdirect.gov.au/bursitis,"what-is, types, symptoms, caused, diagnosed, treated, prevented, doctor, resources"
https://www.healthdirect.gov.au/tendinitis,"what-is, symptoms, causes, doctor, diagnosed, treated, prevented, complications, resources"
https://www.healthdirect.gov.au/blood-pressure-medication,"treated, used, types, reduce, resources"
https://www.healthdirect.gov.au/high-blood-pressure-hypertension,"what-is, high, need-to-know, causes, symptoms, diagnosed, treatment, prevent, resources"
https://www.healthdirect.gov.au/obstructive-sleep-apnoea,"what-is, symptoms, caused, doctor, diagnosed, treated, prevented, complications, difference, resources"
https://www.healthdirect.gov.au/how-to-stop-snoring,"key-facts, what-is, causes, doctor, treatment, resources"
https://www.healthdirect.gov.au/staph-skin-infection,"what-are, symptoms, treated, mrsa, doctor, avoid, resources"
https://www.healthdirect.gov.au/how-to-reduce-visceral-body-fat-hidden-fat,"what-is, caused, risks, know, how, resources"
https://www.healthdirect.gov.au/lupus,"what-is, symptoms, causes, doctor, diagnosed, managed, complications, resources"
https://www.healthdirect.gov.au/connective-tissue-diseases,
https://www.healthdirect.gov.au/autoimmune-conditions,
https://www.healthdirect.gov.au/joint-diseases-and-problems,
https://www.healthdirect.gov.au/diagnostic-tests,
https://www.healthdirect.gov.au/pet-scan,"what-is, how, when, prepare, during, risks, resources"
https://www.healthdirect.gov.au/magnetic-resonance-imaging-mri,"what-is, when, safe, where, during, feel-like, side-effects, alternatives, resources"
https://www.healthdirect.gov.au/cerebral-palsy,"what-is, types, symptoms, causes, doctor, know, diagnosed, manage, prevented, resources"
https://www.healthdirect.gov.au/cystic-fibrosis-cf,"key-facts, what-is, symptoms, causes, diagnosis, treatment, complications, resources"
https://www.healthdirect.gov.au/what-is-a-congenital-disorder,"what-are, types, causes, prevented, detected, managed-pregnancy, managed-born, resources"
https://www.healthdirect.gov.au/lung-cancer,"key-facts, what, symptoms, causes, doctor, diagnosed, stages, treated, treatment-providers, prevented, complications, resources"
https://www.healthdirect.gov.au/pressure-sores-and-ulcers,"what-is, symptoms, caused, doctor, diagnosed, treated, prevented, complications, resources"
https://www.healthdirect.gov.au/angina,"what-is, symptoms, ambulance, doctor, causes, diagnosed, treated, living-with, complications, prevented, resources"
https://www.healthdirect.gov.au/peripheral-neuropathy,"what-is, symptoms, caused, doctor, diagnosed, treated, prevented, complications, resources"
https://www.healthdirect.gov.au/diabetic-neuropathy,"what-is, symptoms, causes, doctor, diagnosis, treatment, prevention, complications, resources"
https://www.healthdirect.gov.au/how-healthdirect-can-help-you,"emergency, helpline, after-hours, access, online, location, information, app"
https://www.healthdirect.gov.au/allergies,
https://www.healthdirect.gov.au/thunderstorm-asthma,"key-facts, what-is, symptoms, causes, doctor, diagnosed, treated, prevented, complications, resources"
https://www.healthdirect.gov.au/asthma,"key-facts, what-is, symptoms, causes, doctor, diagnosed, treated, prevented, complications, questions, resources"
https://www.healthdirect.gov.au/respiratory-system,"key-facts, what-is, function, parts, how-it-works, conditions, care, resources"
https://www.healthdirect.gov.au/sudden-infant-death-syndrome-sids,"what, sids, causes, prevented, infants, risk, support"
https://www.healthdirect.gov.au/asbestosis,"key-facts, what-is-abestotis, causes, what-is-abestos, risk, symptoms, doctor, diagnosis, treatment, prevention, complications, other-illnesses, worried, resources"
https://www.healthdirect.gov.au/elder-abuse,"what-is, forms, protect, what-to-do, resources"
https://www.healthdirect.gov.au/disease-modifying-antirheumatic-drugs-for-arthritis-dmards,"key-facts, what-are, how, prescription, side-effects, doctor, alternatives, resources"
https://www.healthdirect.gov.au/copd,"what, asthma, symptoms, causes, doctor, how, treated, prevented, complications, support"
https://www.healthdirect.gov.au/dry-mouth-syndrome,"key-facts, what-is, symptoms, causes, doctor, diagnosis, treatment, complications, resources"
https://www.healthdirect.gov.au/mouth-diseases-and-conditions,
https://www.healthdirect.gov.au/throat-cancer,"what-is, symptoms, caused, diagnosed, doctor, treated, living-with, prevented, resources"
https://www.healthdirect.gov.au/dental-problems,
https://www.healthdirect.gov.au/dry-socket,"what-is, symptoms, causes, diagnosed, treated, prevented, doctor, resources"
https://www.healthdirect.gov.au/stomach-cancer,"what-is, symptoms, caused, doctor, diagnosed, treated, living-with, complications, prevented, resources"
https://www.healthdirect.gov.au/duodenal-ulcer,"what-is, symptoms, causes, doctor, diagnosed, treated, prevented, resources"
https://www.healthdirect.gov.au/prolapsed-uterus,"key-facts, what-is, symptoms, causes, doctor, diagnosis, treatment, prevention, resources"
https://www.healthdirect.gov.au/arthritis,"what-is, symptoms, causes, doctor, diagnosed, treated, living-with, prevented, complications, resources"
https://www.healthdirect.gov.au/pulmonary-hypertension,"what-is, symptoms, causes, diagnosed, treated, resources"
https://www.healthdirect.gov.au/pulmonary-fibrosis,"what-is, symptoms, causes, doctor, diagnosed, treated, prevented, complications, resources"
https://www.healthdirect.gov.au/questions-to-ask-before-taking-a-medicine,"key-facts, important, benefits, side-effects, dont-take, working, options, how, cost, alcohol, resources"
https://www.healthdirect.gov.au/peg-tube-placement,"what-is, when, prepare, during, recovering, risks, resources"
https://www.healthdirect.gov.au/medicines-for-psoriasis,"what-is, treated, medicine, side-effects, doctor, how-long, more-information, resources"
https://www.healthdirect.gov.au/irregular-periods,"what-are, symptoms, causes, diagnosed, doctor, treated, complications, resources"
https://www.healthdirect.gov.au/wolff-parkinson-white-syndrome,"key-facts, what-is, symptoms, causes, doctor, diagnosed, treatment, prevented, complications, resources"
https://www.healthdirect.gov.au/cleft-lip-and-cleft-palate,"what-is, symptoms, diagnosed, treated, help, complications, resources"
https://www.healthdirect.gov.au/cephalexin,"what-is, use, work, types, more-information, side-effects, not-take, doctor, alternatives, resources"
https://www.healthdirect.gov.au/cataract-surgery,"key-facts, why, benefits, prepare, during, expect, risks, alternatives, resources"
https://www.healthdirect.gov.au/cochlear-implant,"what, implant, benefit, difference, prepare, during, after, wrong, care, resources"
https://www.healthdirect.gov.au/preparing-for-surgery,"choosing, questions, second, leading-up, day-of, after, resources"
https://www.healthdirect.gov.au/pulmonary-embolism,"what-is, symptoms, caused, doctor, diagnosed, treated, prevented, complications, resources"
https://www.healthdirect.gov.au/benign-prostate-hypertrophy,"key-facts, what, symptoms, causes, doctor, diagnosed, treated, prevented, complications, resources"
https://www.healthdirect.gov.au/hysteroscopy,"key-facts, what-is, why, prepare, during, after, risks, doctor, resources"
https://www.healthdirect.gov.au/mirtazapine,"what-is, used-for, work, available, side-effects, careful, doctor, alternatives, resources"
https://www.healthdirect.gov.au/spinal-stenosis,"what-is, symptoms, causes, doctor, diagnosed, treated, resources"
https://www.healthdirect.gov.au/brain-cancer,"what-is, types, symptoms, causes, diagnosed, grades, treated, treatment-symptoms, resources"
https://www.healthdirect.gov.au/ovarian-cancer,"key-facts, what-is, symptoms, causes, doctor, diagnosed, treated, prevention, complications, resources"
https://www.healthdirect.gov.au/thyroid-cancer,"key-facts, what-is, symptoms, causes, doctor, diagnosed, treated, complications, resources"
https://www.healthdirect.gov.au/testicular-cancer,"key-facts, what-is, common, risk-factors, types, symptoms, diagnosed, examine, treated, live-with, resources"
https://www.healthdirect.gov.au/skin-cancer-and-melanomas,"what-is, symptoms, causes, doctor, diagnosis, treatment, complications, prevention, vitamin-d, resources"
https://www.healthdirect.gov.au/non-hodgkin-lymphoma-in-children,"what-is, symptoms, causes, doctor, diagnosed, treated, prevented, complications, resources"
https://www.healthdirect.gov.au/bowel-cancer,"what-is, symptoms, causes, doctor, screened, diagnosed, treated, prevented, complications, resources"
https://www.healthdirect.gov.au/cellulitis,"key-facts, what-is, symptoms, causes, diagnosis, treatment, doctor, prevention, resources"
https://www.healthdirect.gov.au/skin-conditions,
https://www.healthdirect.gov.au/bowens-disease,"what-is, symptoms, causes, doctor, diagnosed, treated, prevented, complications, resources"
https://www.healthdirect.gov.au/neuroendocrine-cancers,"key-facts, what-is, symptoms, causes, diagnosed, treated, living-with, resources-support"
https://www.healthdirect.gov.au/cat-and-dog-allergy,"key-facts, what-is, causes, symptoms, diagnosed, living-with, treatment, resources"
https://www.healthdirect.gov.au/fever-in-children-infographic,
https://www.healthdirect.gov.au/fever-and-high-temperature-in-children,"what-is, symptoms, causes, doctor, diagnosed, treat, prevented, complications"
https://www.healthdirect.gov.au/types-of-thermometer,"why, how, types, resources"
https://www.healthdirect.gov.au/australian-mental-health-services,"emergency, professionals, community, specialist, inpatient, connect, who-pays, resources"
https://www.healthdirect.gov.au/mental-health-professionals,"types, how-to-find, choose, expect, confidential, change, cost, resources"
https://www.healthdirect.gov.au/gout,"what-is, symptoms, causes, risk, doctor, diagnosed, treated, prevented, complications, resources"
https://www.healthdirect.gov.au/medicines-for-gout,"what-is, treated, treatment, prevention, side-effects, how-long, doctor, more-info, resources"
https://www.healthdirect.gov.au/mental-health-nurses,"what-is, conditions, where, when, expect, questions, referral, resources"
https://www.healthdirect.gov.au/pneumonia,"what-is, symptoms, causes, doctor, diagnosed, treated, prevented, other, resources"
https://www.healthdirect.gov.au/pleurisy,"key-facts, what-is, symptoms, causes, doctor, diagnosed, treated, prevented, complications, resources"
https://www.healthdirect.gov.au/legionnaires-disease,"what-is, symptoms, caused, doctor, who, diagnosed, treated, prevent, complications, resources"
https://www.healthdirect.gov.au/lung-conditions,
https://www.healthdirect.gov.au/drugs-and-alcohol,
https://www.healthdirect.gov.au/peripheral-vascular-disease,"what-is, symptoms, causes, doctor, medical-advice, diagnosed, treatment, prevention, related-problems, resources"
https://www.healthdirect.gov.au/heart-and-cardiovascular-conditions,
https://www.healthdirect.gov.au/pancreatitis,"key-facts, what-is, symptoms, causes, doctor, diagnosis, treatment, prevention, resources"
https://www.healthdirect.gov.au/malabsorption-syndromes,
https://www.healthdirect.gov.au/pancreas,"what-is, function, parts, work, conditions, take-care, resources"
https://www.healthdirect.gov.au/bone-diseases,
https://www.healthdirect.gov.au/osteoporosis,"what-is, symptoms, causes, doctor, diagnosed, treated, prevented, complications, resources"
https://www.healthdirect.gov.au/hormones,
https://www.healthdirect.gov.au/pancreatic-cancer,"what, symptoms, causes, doctor, diagnosed, treated, prevented, support"
https://www.healthdirect.gov.au/osteopaenia,"what-is, why, symptoms, diagnosed, treated, resources"
https://www.healthdirect.gov.au/health-checks-for-women,
https://www.healthdirect.gov.au/cervical-cancer,"key-facts, what-is, symptoms, causes, doctor, diagnosed, treatment, managed, complications, prevention, resources"
https://www.healthdirect.gov.au/womens-health,
https://www.healthdirect.gov.au/genital-warts,"key-facts, what-are, symptoms, causes, doctor, diagnosed, treated, prevented, complications, coping, resources"
https://www.healthdirect.gov.au/health-screening-tests,
https://www.healthdirect.gov.au/cervical-screening-test,"key-facts, what-is, who, where, booking, during, self-collection, results, resources"
https://www.healthdirect.gov.au/overcoming-addiction,"key-facts, what-is, change, support, treatment, cope, cravings, relapse, living, resources"
https://www.healthdirect.gov.au/what-is-addiction,"key-facts, what, begin, symptoms, treated, resources"
https://www.healthdirect.gov.au/addiction-withdrawal-symptoms,"key-facts, what-is, symptoms, doctor, treatment, help, resources"
https://www.healthdirect.gov.au/cryptosporidiosis,"what-is, symptoms, causes, doctor, diagnosed, treated, complications, prevented, resources"
https://www.healthdirect.gov.au/parasite-conditions,
https://www.healthdirect.gov.au/hysterectomy,"what-is, need, considering, types, recovering, after, resources"
https://www.healthdirect.gov.au/blocked-tear-duct,"key-facts, what-are, causes, symptoms, doctor, diagnosed, treatment, prevent, resources"
https://www.healthdirect.gov.au/hormone-replacement-therapy,"what-is, types, benefits, risks, reduce, doctor, alternatives, resources"
https://www.healthdirect.gov.au/guide-to-menopause,
https://www.healthdirect.gov.au/hot-flushes-due-to-menopause,"key-facts, what-are, symptoms, causes, doctor, diagnosis, treatment, prevention, complications, resources"
https://www.healthdirect.gov.au/general-anaesthetic,"key-facts, what-is, why, prepare, how, wake-up, side-effects, risks, resources"
https://www.healthdirect.gov.au/local-anaesthetic,"what-is, how, types, prepare, expect, complications, resources"
https://www.healthdirect.gov.au/medicines,
https://www.healthdirect.gov.au/heart-palpitations,"key-facts, what-are, symptoms, causes, diagnosis, doctor, treatment, prevention, resources"
https://www.healthdirect.gov.au/cardiomyopathy,"what-is, types, symptoms, caused, doctor, diagnosed, treated, prevented, complications, resources"
https://www.healthdirect.gov.au/heart-attack,"what-is, symptoms, causes, doctor, diagnosed, treated, prevent, complications, cardiac-arrest, covid-19, after, resources"
https://www.healthdirect.gov.au/heart-arrhythmias,"what-are, types, symptoms, ambulance, doctor, causes, diagnosed, treated, complications, prevented, resources"
https://www.healthdirect.gov.au/tachycardia,"key-facts, what, types, causes, symptoms, diagnosed, treated, complications, prevented, help, resources"
https://www.healthdirect.gov.au/statins,"what-is, how, who, side-effects, doctor, alternatives, resources"
https://www.healthdirect.gov.au/heart-surgery,
https://www.healthdirect.gov.au/heart-transplants,"key-facts, what-is, who, donate, long, happens, affect, help, resources"
https://www.healthdirect.gov.au/bones-muscles-and-joints,"what-are, bones, muscles, joints, bone-conditions, joint-disorders, muscle-disorders, doctor, resources"
https://www.healthdirect.gov.au/pacemaker,"key-facts, what-is, who, inserted, risks, life, resources"
https://www.healthdirect.gov.au/healthy-heart-diet,"important, nutrition, food-drink, avoid, example, motivated, how-else, doctor, resources"
https://www.healthdirect.gov.au/metabolic-syndrome,"what-is, symptoms, causes, diagnosed, treatment, medicines, prevented, what-to-do, resources"
https://www.healthdirect.gov.au/kidney-pain,"what-is, symptoms, causes, doctor, diagnosed, treated, resources"
https://www.healthdirect.gov.au/organ-transplants,"key-facts, what-is, types, when, donate, transplant, emotions, life, resources"
https://www.healthdirect.gov.au/gastric-bypass-surgery,"key-facts, what-is, benefits, when, prepare, during, expect-after, risks, resources"
https://www.healthdirect.gov.au/gastric-sleeve-surgery,"key-facts, what-is, benefits, when, prepare, during, expect-after, risks, resources"
https://www.healthdirect.gov.au/lap-band-surgery,"key-facts, what-is, benefits, when, prepare, during, expect-after, risks, resources"
https://www.healthdirect.gov.au/guide-to-bariatric-surgery,"key-facts, what-is, types, benefits, when, which, risks, expect-after, alternatives, resources"
https://www.healthdirect.gov.au/kidney-transplants,"key-facts, what-is, candidate, donate, waiting, kidney, affect, help, resources"
https://www.healthdirect.gov.au/laryngitis,"key-facts, what-is, symptoms, causes, doctor, diagnosis, treatment, prevention, complications, resources"
https://www.healthdirect.gov.au/throat-diseases,
https://www.healthdirect.gov.au/anatomy,
https://www.healthdirect.gov.au/leg-ulcers,"what-is, symptoms, caused, treated, prevented, doctor, resources"
https://www.healthdirect.gov.au/leukaemia,"key-facts, what-is, types, symptoms, causes, doctor, diagnosed, treated, prevented, complications, resources"
https://www.healthdirect.gov.au/stem-cells,"what-are, where, why, types, benefits, treatments, donation, controversies, resources"
https://www.healthdirect.gov.au/leukaemia-in-children,"key-facts, what-is, symptoms, causes, doctor, diagnosed, treatment, living-with, prevented, complications, resources"
https://www.healthdirect.gov.au/blood-disorders,
https://www.healthdirect.gov.au/white-blood-cells,"what, do, types, made, healthy, problems, support"
https://www.healthdirect.gov.au/guide-to-cosmetic-surgery,"key-facts, what-is, who-can-perform, plastic-vs-cosmetic, doctor, find-surgeon, questions-to-ask, body-image, alternatives, cost, overseas, resources"
https://www.healthdirect.gov.au/kidney-stones,"key-facts, what-are, symptoms, causes, diagnosis, treatment, prevention, complications, resources"
https://www.healthdirect.gov.au/kidney-infection,"key-facts, what-is, causes, symptoms, doctor, diagnosed, treated, prevent, resources"
https://www.healthdirect.gov.au/nephrotic-syndrome,"what-is, symptoms, causes, diagnose, treat, resources"
https://www.healthdirect.gov.au/kidneys,"key-facts, what-is, function, parts, how, conditions, care, resources"
https://www.healthdirect.gov.au/kidney-function-tests,"key-facts, what-are, why, prepare, understanding-results, resources"
https://www.healthdirect.gov.au/liposuction,"key-facts, what-is, right, find, prepare, during, after, doctor, risks, costs, resources"
https://www.healthdirect.gov.au/cosmetic-procedures,
https://www.healthdirect.gov.au/bladder,"what-is, what-happens, hold, conditions, tests, resources"
https://www.healthdirect.gov.au/dialysis,"what-is, when, how, life, supportive-care, resources"
https://www.healthdirect.gov.au/kidney-cancer,"what, types, symptoms, causes, how, treated, living, support"
https://www.healthdirect.gov.au/keratosis-pilaris,"what-is, symptoms, causes, doctor, diagnosed, treated, resources"
https://www.healthdirect.gov.au/squamous-cell-carcinoma,"key-facts, what-is, types, symptoms, diagnosis, treatment, doctor, prevention, resources"
https://www.healthdirect.gov.au/itchy-skin,"what-is, causes, doctor, diagnosed, treated, prevented, complications, resources"
https://www.healthdirect.gov.au/contact-dermatitis,"what-is, symptoms, causes, doctor, diagnosed, treated, prevented, complications"
https://www.healthdirect.gov.au/dealing-with-morning-sickness,"what-is, causes, doctor, diagnosed, treated, prevented, complications, resources"
https://www.healthdirect.gov.au/pregnancy,
https://www.healthdirect.gov.au/long-covid,"what-is, symptoms, causes, doctor, diagnosed, treated, living, complications, prevented, resources"
https://www.healthdirect.gov.au/blood-transfusion,"what-is, why-need, risks, types, what-happens, feel-during-after, refuse"
https://www.healthdirect.gov.au/cancer-immunotherapy,"what-is, work, given, cancer, types, side, resources"
https://www.healthdirect.gov.au/cancer-treatments,"what-kinds, surgery, chemotherapy, radiotherapy, immunotherapy, hormone-therapy, targeted-therapy, ablation, alternatives, clinical-trials, resources"
https://www.healthdirect.gov.au/covid-19-vaccine-faqs,"who, why, doses, every-year, where, cost, recovering, flu, flu-vaccine, side-effects, prove, resources"
https://www.healthdirect.gov.au/blood-types,"what-are, different, know, transfusions, resources"
https://www.healthdirect.gov.au/anaemia-medicines,"what-is, work, types, side-effects, doctor, alternatives, resources"
